score|username|time|title|content
5（满分 5 分）|TTeleven|2020年2月15日|小学生中学生回去好好写作业吧！|最近真的太多恶意差评了，一些小学生中学生网友给了差评后还要很骄傲的在其他网站上煽动大家一起来差评，实在看不下去了！老师给你留作业让你学习成了钉钉这个软件的错？要是不想写作业不想学习，有种你就别做！不敢违反家长不敢对抗老师，小小年纪就只会来当键盘侠！长大以后想必也没什么出息！不求你们以后对社会做什么贡献，别捣乱就成！最后说一句，钉钉挺好用的！
5（满分 5 分）|天空题卡|2020年2月15日|来自初一学生|疫情影响 绝大部分地区选择延长假期开展网上授课 钉钉果断成为广大学校的使用对象 但我希望大家不要借此机会将各种不满情绪发泄到软件上 既然选择了学习这条道路 恳请大家认认真真踏踏实实的走下去 我相信大家一定能收获学习中的快乐💭。一起加油
5（满分 5 分）|阿纳答|2020年2月15日|说|我不上网课也不直播，但还是觉得这个恶意打分非常小学鸡，学习这个事情真的断了就是断了会玩完的，奉劝各位小学鸡珍惜学习机会😃。钉钉本身作为一个办公软件我认为是非常人性化以及智能的，各位打恶评的注意下，发泄请找对的人
5（满分 5 分）|月亮抛硬币|2020年2月14日|一名高中生的想法|不爱请别伤害好吗？难道钉钉下架我们就不用学习了吗？老师就不会去用别的软件上课吗？钉钉本来就是个办公软件谁知道老师开发了新功能？如果真下架了知不知道会耽误别人办公？一些人能不能别那么自私了？大家都不小了看问题能不能全面点？现在就是上学的年纪你不学习还想干什么？别再恶意低分了，理智点吧。
4（满分 5 分）|倩楠_|2020年2月12日|特别客观的来讲一下|钉钉确实在一些地方做的不够好 但是这个软件本身也不是用来大规模上网课的啊 本身就已经到了开学的时候但是因为疫情严重网课就是最好的方式啊 为什么要喷呢。如果说能将一些点提升一下 更适合最近这个情况来说应该会更好
5（满分 5 分）|偷税-|2020年2月14日|有一说一真的没必要|没必要打低分好吧，其实挺搞不懂你们为什么给一个那么好的软件无理由低分，就因为网课？大部分学生还是挺期待的，不喜欢别上呗老师也不会砍你为什么祸害一个那么好的软件，刷低分纯粹为了开心的你们省省吧
5（满分 5 分）|媚晴|2020年2月14日|钉钉只是一个工具|钉钉只是一个工具啊 不要把脾气发到它上面鸭 老师开直播是可以选择开不开学生摄像头的 而且你可以手动关啊 而且我觉得它可以显示消息已读或未读的功能特别好！和同学私下交流也很方便！学习是自己的事 你要不想学 也没人能逼你 试问 别人都在学 只有你在玩 你不会心慌吗？？所以我们还是一起学习吧！
5（满分 5 分）|飞翔的鹰～！|2020年2月13日|大家上网课是应该的，用知识充实大脑不好吗（本人初二）|为什么黑钉钉呢？程序员以及无数后台人员都不容易啊。免费给学生提供平台学习，在这种特殊时期，我认为钉钉并没有做错什么，反而一些学生也要反思，祖国给予我们的希望我们是要努力实现的！而不是想着玩啊！
5（满分 5 分）|东方伊斯顿|2020年2月13日|正确对待网课，客观评价钉钉。|非常时期，钉钉能够实现网络授课，避免因无法出门耽误学习，能够网络办公，让很多小微企业和打工者多了一线生机。钉钉只是提供了一个平台，就遭到不懂事的孩子们的围攻，很可能还有同行业的黑手。抛开恶性商业竞争，但就学生而言，这是填鸭式教育、应试教育体制的悲哀，年轻一代的悲哀，国家教育部门也应该反思，我们的教育之路应该怎样走下去。
5（满分 5 分）|Hoganbam|2020年2月13日|钉钉伴随我一生|讲真，钉钉我一直用了很久了，只从出了表单就一直用，可是现在却收费了，这个很不好，希望能改进，其他功能很好，特别是对于销售来说，成为我跟踪客户的工具，之所以评论，是告诉大家，不要因为一时不快而放弃它，总有我们需要的时候，要正面评价，同时希望钉钉团队对价格有所调整，谢谢
5（满分 5 分）|昨日青空💫|2020年2月13日|一手好牌打得稀烂|现在疫情严重影响着我们的学习，看到有的老师为了不耽误我们的课程，去学习了做直播搞网课，有的学生真的让人心寒。老师们愿意跑到学校对着一个手机给你们讲课，有的学生仍然不愿意听课，我作为一个学生，我都开始担心了，偏偏有的人还悠闲自得。一手好牌让你打得稀烂，好好的智商你不努力，到头来你的人生也是稀烂！
5（满分 5 分）|“‘「邱金龙」’”|2020年2月13日|写差评的学生就是丢我们这一代人的脸|这么好的软件，为我们在疫情期间学习提供了便利，而且这软件开发商，以及软件本身并没有错，搞得跟写差评就不用学习了一样，那些不爱学习的人，你们不学没事，但是不要去诋毁钉钉软件本身好吗？钉钉这次为学生党的学习提供了非常大的便利啊.而且其他同行软件都是要钱的，只有钉钉免费！人家钉钉CEO当初做钉钉的这个创意你们不能这样侮辱啊！毕竟这软件也是软件的心血！你的不学习，不是你用来诋毁他人的理由！
5（满分 5 分）|再重复我就哈哈哈哈哈哈哈了|2020年2月12日|软件非常好|我真的是服了，一些学生竟然因为不想上课而恶意评论，还希望钉钉被强制下架，看到这些人真的很令人气愤。老师也不容易，大家都不容易，软件开发商就有错吗，他们不是为服务人民才做的吗。真心希望那些人放下你高贵的手，多学点习吧。希望开发商不要受影响，钉钉是一个非常好的软件，不管是学习还是办公，都非常有用，希望钉钉变得更好，加油！
5（满分 5 分）|五月的月亮🌙|2020年2月12日|很人性化|其实钉钉的很多设计都很人性化，内容也很齐全，但不明白为什么有些同学不停污蔑它。很喜欢这个软件，作为一个初三的学生，钉钉确实给我们带来了很多的帮助，有些设计也很合理，希望大家不要再贬低这样优秀的软件了，每个参与研发的人员都不容易，希望大家尊重别人的成果。
3（满分 5 分）|我是一个Lair|2018年4月19日|希望反馈的问题可以有所改进|主要就是个人觉得消息免打扰模式，手机和客户端同步这个希望可以不要同步，就像是我在电脑端需要接收消息，而我在手机上可能不需要，那如果我不开免扰模式，手机也一直响就很烦，如果开了免扰模式，那我电脑上也就没有提示了，这点真的很麻烦！！！
5（满分 5 分）|摩西摩西康桑密达|2018年5月4日|更新快，越来越好用|非常早开始使用钉钉，现在功能越来越多，用的朋友也越来越多，出去还是会向朋友的公司推荐这款软件，它上面随时可以查看员工的出勤，日报和审批也慢慢完善了，整体能够帮助公司提升很多效率！
4（满分 5 分）|系统漏洞2020|2020年2月12日|一位高中班主任使钉钉用的几点建议|由于疫情原因，我们开通了钉钉班级群，平心而论，丁丁在办公方面的功能确实很强大，强大到有点恶心。但是在家校管理方面，我觉得还是有待提升的。 比如说家校北发布作业。老师收到作业后，可以看到同学提交的作业拍照。点开后可以编辑，但是编辑以后能不能直接提交到网上，这样学生可以直接看到，更好一些。第二，关于打卡任务，为什么要最少21天呢？有时候就是当天用一次。
5（满分 5 分）|倌訞|2020年2月11日|感想|钉钉其实按照我现在上网课的体验来说，功能还是很全很好用的，毕竟是学生，我们面临的是重要的考试，想偷懒的同学也不要把气撒在一个软件上，那并没有什么用，况且还显得你自身素质不高，一起好好学习拥有所热爱的事物不好吗
5（满分 5 分）|h12138👌👌|2020年2月11日|真的挺好一软件|这个软件其实很好用，评分低也只是因为它性能强，被很多学校用来上网课。用来传文件也比较方便。为什么有些学生会给这个软件差评呢？这个软件明明帮助了你获取知识。而且要怪也不能怪软件，这只是个平台，不要再做这么幼稚的行为了吧。没有恶意👌祝钉钉获得成功～
5（满分 5 分）|Gu.ZX|2020年2月9日|高中生的看法|虽然说是要求下载的，但是首先我觉得大家不应该因为这个而消极看待这个软件。提供网络教学也是为了大家。然后就是我觉得这个软件相当不错，办公与学习很有针对性，设计的也相当合理，很方便！
5（满分 5 分）|顺迈高中高一|2020年2月7日|没有师德的老师|我知道这种方式是在疫情期间很好的学习方式，但是为什么学校老师就钻空子，正常开学的时候还没到，假期作业还没写完就开始了新学期的讲课，这是对学生的不负责，这些老师真的是没有师德，不是不支持讲课，而是在还没结束假期的时候应该讲一些学生问的问题，而不是早早的开始补课，碰这种老师我真的是很无语
5（满分 5 分）|钉钉的声援者|2020年2月7日|为钉钉声援|钉钉是一个很好的软件，我和我的老师一起尝试过许多的软件，都没有钉钉这么好用，在这个特殊的时期，老师们还能够放弃自己的假期，来开课，老师们真的辛苦了，我也希望那些因为不想上课/学的那些人，看清自己。你不想学习，那你不要去祸害别人，你不想上进，那你别欺骗别人。还有那些因为这一个软件而来声讨整个阿里巴巴企业的键盘侠们，求你们做个人吧
5（满分 5 分）||||
5（满分 5 分）||||
5（满分 5 分）||||
5（满分 5 分）||||
5（满分 5 分）||||
5（满分 5 分）||||
5（满分 5 分）||||
5（满分 5 分）||||
5（满分 5 分）||||
5（满分 5 分）||||
5（满分 5 分）||||
5（满分 5 分）|ljf_3399|2020年2月16日|钉钉给予的力量|挺好的一款软件，考勤报表两秒一键自动生成，提高了办公效率，签到位置实时动态，视频会议解决了不同地点开会问题，审批解决了各种找领导困难问题，疫情期间的直播解决了好多学生的学习问题，挺好的呀！孩子们不懂事，家长要顶起来。
5（满分 5 分）|1917931875|2020年2月15日|钉钉|钉钉其实挺好的，上课时如果哪里还没明白，可以看回放，这一点不错👌就是老师让回答问题时，连麦建议语音说话，开摄像头有可能会有不好的情况发生，还有就是网卡推出再进来的时候建议还按原来的时长，不要从零开始，这样太容易误会了
5（满分 5 分）|（gkjy）|2020年2月15日|高三很需要|我也想要考上大学想过自己未来想要的日子二轮复习到了但我不能在家干等我需要学校系统的学习我想要开学但这种方式我也接受最后说一句我想开学我想顺利毕业
5（满分 5 分）|kokophone6|2020年2月15日|掌握自己的人生，别被带跑了。|钉钉一直是公司着重使用的网络化办公软件，也是因为疫情突然，才被大量用作教育行业的网络课堂软件，且无偿。这是不得已，也是目前看来最好的选择。有人说钉钉“剥夺”了假期，实际上比你努力的人，你的假期他都在努力。别总说什么人家天资聪明，这是自己一砖一瓦努力的回报。别用自己的愚昧和鼠目寸光影响这个世界，也别用一时的冲动让别人付出代价。
5（满分 5 分）|Anonさにた|2020年2月15日|我认为钉钉很无辜|作为一个自律性不太好的人，真的很希望有方法约束自己，感谢钉钉给我在疫情期间管理自己的机会，我个人认为钉钉很无辜，站在开发者的角度来讲，钉钉的各种功能可以给用户带来方便，作为一名用户，钉钉强大的功能给我带来学习，办公上的方便，这次疫情钉钉有错吗？让我们的每天打卡上课的钉钉？难道老师不想再陪陪家人？如果没有疫情，我们还是要去上学，只是钉钉在疫情期间作为主要的学习平台而已，如果是因为气愤给钉钉差评的话，未免太冲动了。如果是因为玩梗就打差评的话，麻烦要有个限度，没有钉钉还有其他平台，不应该让钉钉成为此次疫情的受害者！
5（满分 5 分）|四夕残舟|2020年2月15日|无脑喷很没素质|其实我觉得钉钉非常好，不知道为什么这么多人无脑喷，钉钉作为一个特殊时期使用的学习软件，从各种配置上都是比较高级的，而且是免费向学生提供的，这还不够？？如果你不想学习，可以和学校老师说，完全没有必要把怒气撒在钉钉这个软件上，这样的恶意差评真的很没素质
5（满分 5 分）|赵赵赵1995zzz|2020年2月15日|心疼钉钉|第一次给软件评价，因为看到钉钉的新闻，觉得钉钉好可怜，学生因不想上网课把气撒到软件身上，给软件低分评价我觉得太不理智了。等长大了难道还要因为需要钉钉打卡工作等再次低分差评吗？反而我觉得钉钉本身做得好，才会让这么多单位想用它吧，以至于在特别的时期选择用钉钉上网课。上不了课期间要上网课不是钉钉能决定的，大家理智评分，不要把自己的痛苦嫁接到别人的痛苦之上吧，做软件不易，因为一个这样的理由低分下架太不值得了。5星支持下！
5（满分 5 分）|Amethyst64|2020年2月15日|学生们太不懂事了|这是一个功能强大的远程协同工作软件，它的开发程度比较完善，这也正是为何足不能出户的时期它被从幼儿园到大型企业都选择的原因。可是我们的学生，把自己的厌学情绪，对学校对老师的不满发泄在这样一个优秀的软件上。小学生不懂事、初中生也不懂事吗？初中生不懂事、高中生大学生也不懂事？一夜12万差评被拿来当做趣事传播，这哪里有趣？这明摆着是我们国民教育的悲哀。
5（满分 5 分）|冬日日天|2020年2月15日|你们是中国的希望，好好学习鸭|请不要再恶意评价钉钉这个良心软件了。孩子们你们别忘了你们的任务是学习。时间是宝贵的，钉钉提供了平台让你们能抓紧时间学习，让你们安安心心在家中上课，你们是中国未来的希望，全国都在保护着你们，让你们不受疫情的伤害。希望祖国的花朵们能把握每一个学习的机会，利用每一个学习的平台。学习的过程必然是艰苦的，可是现在你们的学习生活却是我们最渴望回到的过去。加油！
5（满分 5 分）|何呵呵真的呵呵了|2020年2月13日|黑钉钉真的可耻|一些学生就不能一码归一码吗？看到一些人不停地给钉钉刷一星，真的感觉特别恶心，想要钉钉下架，钉钉本意只是为了帮助办公，有些人用各种方法攻击钉钉，骂钉钉，真的是服了 只是因为学校借助钉钉来上网课 九年制义务教育 道法 不就是为了让我们成为拥有学识有教养的人吗？而不是为了培养出一堆喷子和素质低下的人
5（满分 5 分）|是南栀啊～|2020年2月13日|现在的学生都怎么了？|由于疫情的影响，大多数学校都会选择直播授课，这不是挺好的吗？作为一名初三应届毕业生，我反正是很赞同老师们的做法的，毕竟要以学业为重啊！毕业生们都想上一个好高中，好大学！但为什么有些不理智的人偏偏要去给钉钉刷低分呢？！真的是无法理解，你不想上课大可不上，但请你不要影响到别人好吗？！刷低分到一分以下钉钉就会强制下架，我想做这种的事儿的大概都是些小学生吧……真的无语了，钉钉挺好用的，很方便快捷。我真的不想飙脏话，但也请这些不自觉不自律的人要点B脸👌？
5（满分 5 分）|樱哲|2020年2月13日|无|一开始知道要上网课时，我还有些不情愿，但是，如果没有这些平台帮助，很多学生都无法学习，在疫情面前，我们能做的只有足不出户学习，真搞不懂有些人故意打低分让下架有什么意思，反正我现在喜欢上网课，班上的同学一起学习也很愉快，支持各大学习平台网站！！！
5（满分 5 分）|曲钰言|2020年2月13日|理智对待|钉钉对于刚接触的同学们来说确实很烦，还要上网课，但是它真的很方便啊。很多东西都可以在钉钉上完成。我很喜欢这个软件，这个软件开发者的心血不应该被这样糟蹋！希望可以理智的看待钉钉看待这个事件。而且就算把钉钉刷下架了，难道你们就不学习了吗？什么时候学习变得让你们觉得厌恶讨厌了？哪怕今天没了钉钉这个软件也会有其他的软件出来。希望脖子上东西不是一个摆件儿👀👀
5（满分 5 分）|HW.憨b|2020年2月12日|都是为了你们好啊。我也是初中生。很理解|我求你们不要在恶意差评了好叭。老师们也是为了我们好。你何必要举报一个软件？难道这软件下架了就好？还有其他软件可以上网课。难道你们都要举报？就算不上网课，难道你们想去上学感染病毒？請你们善良点好叭。一个软件做出来很不容易。我也是中学生，知道你们那种不想上课的想法。但是这种学习软件是对我们有益处。钉钉2017上架头一次遇到你们这种。软件公司很无奈的好叭。你们换位思考一下，你花了很长时间做出来对人有好处的东西却被恶意说不好，你们心里很好受吗？请你们尊重所有软件。不要污蔑他们。谢谢
5（满分 5 分）|Duivviitsxm|2020年2月11日|无语了|对于上班族来说这个软件挺好用的 那些不想上网课的学生如果不想学习的话要不主动退学？不仅不用上网课了 以后也不用去学校了天天都是假期岂不乐哉 学习是自己的 不想学习拿一个软件泄愤不太符合你们这些给一星人的逼格啊 要不猛一点直接退学啊
5（满分 5 分）|顶上长朵花|2020年2月11日|高一学生|我真的认为这个软件蛮好的，上课跟不上的时候也不用着急，因为可以看回放，并且还可以加速，我觉得这个软件真的很好，某些学生麻烦再对钉钉恶语诅咒的时候麻烦想想，钉钉是针对你们设计的吗？也太多情了吧，要求你们怎么做的是老师，不是钉钉留的作业，不是钉钉给你们上课的，钉钉是辅助工具，你凭什么把怨气撒在软件身上，大家都是学生，学习不容易，人家工作更不容易，人家辛辛苦苦设计软件，就因为你对学习的不满评分那么低，你好意思吗？
5（满分 5 分）|钉钉发声|2020年2月8日|为钉钉发声|有些人是不是心里扭曲我知道，我就说说我自己的感受，钉钉我一直在用，使用起来也挺方便的。钉钉用来办公用的，网课的是学校安排的，它就是个工具，有本事你去学校投诉去教育局反映，在这里和软件差评算什么本事。看看最近的差评能让人笑死，希望以后的新用户能不因为评分而错过这个软件，也希望官方能正视这件事情，为钉钉发声！
5（满分 5 分）|不过一个月 v|2020年2月7日|挺好的啊|我们高三学生巴西不得多学点，高考快来了，真的很紧张，我给一星是为了让那些放长假能学习还不高兴的同学看，你们爱看不看，课程拉下了真的很糟糕，我不是一个学习成绩很好的人，平时总分也在两百左右，所以高考快来了我真的觉得钉钉不错可以看回看的主要是
5（满分 5 分）|命中注定omi|2020年2月1日|企业协同效率神器|钉钉真的非常好用，有很多尚待发掘的功能用来提升企业协同效率，我非常喜欢审批和智能填表。现在新冠疫情，已经用上健康管理要求员工每日汇总个人健康信息，方便我们企业灵活实时应对疫情。
5（满分 5 分）|F（OR彭俊鸿|2019年12月31日|最喜欢没有假装的真实|实力大，安全可靠噗遇到心动的她正能量小应用，里面人发布的东西都很阳光，拒绝负能量的聊天软件能够做的这样就已经可以了，很不错
5（满分 5 分）|分手不让 拿走锅|2019年12月31日|最喜欢没有假装的真实|实力大，安全可靠噗遇到心动的她正能量小应用，里面人发布的东西都很阳光，拒绝负能量的聊天软件能够做的这样就已经可以了，很不错
5（满分 5 分）|杨湙|2019年1月14日|邮箱密码丢失后IT报修反馈超快|阿里邮箱密码不明原因显示不对，原始密码没改过，估计是时效问题，我一直忘记改密码了。周六晚报修，周一就反馈回来已经修复好了，应该是周一IT部的同事上班就帮忙处理这个事情了，然后马上反馈给我。感谢IT部的同事，很抱歉给你们增添麻烦。希望我们公司所有部门都可以有这样的效率，事事有回应，件件有结果。
5（满分 5 分）|暗-影迷宗|2019年12月31日|最喜欢没有假装的真实|实力大，安全可靠噗遇到心动的她正能量小应用，里面人发布的东西都很阳光，拒绝负能量的聊天软件能够做的这样就已经可以了，很不错
5（满分 5 分）|金 刚爸比|2019年12月31日|最喜欢没有假装的真实|实力大，安全可靠噗遇到心动的她正能量小应用，里面人发布的东西都很阳光，拒绝负能量的聊天软件能够做的这样就已经可以了，很不错
5（满分 5 分）|动物学家纽特文化教育发展有限公司|2020年2月19日|良心被狗吃了？给一星的学生党？|钉钉是一款办公用品，开发商的初衷是为了办公方便。这次疫情钉钉变成了一个学习的软件，是为了能让大家在疫情期间停课不停学。我是一个初一的学生，我觉得钉钉真的很好，你们的良心被狗吃了吗？给一星的学生党们。我的妈妈以前办公的时候用的就是钉钉。软件做得真的很好。如果你们觉得这样不合适，你们可以找老师打抱不平啊，你们没那个能耐，就把气撒到钉钉身上。卑鄙🤢恶心🤢tui🤢以下是充字数：我也是很喜欢的人和事物的本质是什么时候回来的时候我就不去了，我也是很喜欢的人和事物的本质是什么时候回来的时候我就不去了，我也是很喜欢的人和事物的本质是什么时候回来的时候我就不去了，我也是很喜欢的人和事物的本质是什么时候回来的时候我就不去了
5（满分 5 分）|绿漾北遥|2020年2月19日|歌挺好听的|歌挺好听的，工作人员辛苦了，难为你们了，以下为凑字数为什么还不能点击发送已经三十个五字了不会要我写一百字吧倒也不必吧我只是想给它一个好评啊噢原来我没填标题填了就能发送了
5（满分 5 分）|shhdhhdb|2020年2月19日|努力的尚班朱|钉钉是一个好软件无容置疑。
5（满分 5 分）|故意犹太人发吃饭|2020年2月18日|网课一线牵珍惜这段缘|看过钉钉求好评的视频特地过来给了五星，其实就算没有钉钉也会有别的软件来上网课，可能大家只是单纯不想上课而已，所以大家没必要恶意去刷低分，作为一个办公软件钉钉已经尽力做到最好，被大家评一星也只是卖卖萌求放过，现在正是国家有难的时候，我们既然宅家就能做贡献，那就让钉钉来一起陪我们度过这段困难时期，相信这段经历会永生难忘。
5（满分 5 分）|唯康灬|2020年2月18日|给钉钉挽尊，哈哈！|我工作以后才接触钉钉，不得不说钉钉功能强大，使用方便，办公效率高效，绿色环保。单纯作为一款办公应用来说，真的很不错了。但作为背锅侠，额，不说了。。。。。。对于网络教学，即使没有钉钉，也会有其他的应用来替代，网络教学可是教育部提出来的，神兽们有本事去搞定教育部，这样你们假期想怎么嚯嚯就怎么嚯嚯。有人督促学习也没什么不好的，不管自己愿不愿意，至少是在积累学识，高考，可能是你们一生中学识积累的顶峰时刻了，然后就会开始走下坡路，等进入社会以后，学习都要靠自觉，很多人都会被惰性所打败而变得平庸，碌碌无为。网络一线牵，珍惜这段缘吧，哈哈。。。。
5（满分 5 分）|无法外出的我|2020年2月18日|感谢钉钉帮助在这个时间参加公司培训|疫情导致我们无法外出拜访客户。公司通过这个平台每天给我们线上直播一些技术教学。每天都有新的收获。直播很流畅，给你点个赞。孩子们也希望你们冷静，尊重别人的劳动成果。这也是品德学习中的一课。
