score|username|time|title|content
4（满分 5 分）|难得北方|2018年8月7日|“打耳光”等表情建议取消|钉钉在很大程度上把生活和工作分开，这点很便捷，非常感激保护了用户的个人生活. 但是请注意一下细节方面的问题，这毕竟是一个工作软件，里面有些表情希望不要添加在里面，比如 “打耳光” 被领导发这个表情在群里，造表情无心，使用者也无脑，这种比较过分的表情拉低了钉钉的层次. 大家看到这些表情也很难受
5（满分 5 分）|谈腻了得爱|2018年9月20日|盯盯好用|我们的生活就是这样简单生活才不会让自己变的更美好、你要的不是我的生活习惯了每天早上起来都是你自己吃东西没有吃东西没了？不想吃太胖子
5（满分 5 分）|QQ企鹅|2018年9月26日|好用方便！|好用方便，可以有效的提高工作效率，如果添加云后台功能，把已完成的工作流程自动转存在云内存当中，这样就不会存在因人员流动而造成工作任务消失
5（满分 5 分）|她好就好拉|2019年2月14日|发个红包，。我的事了没啊你不理我的时候可以到我们这里也是可以的很强势一点都不好意思|嘎嘎嘎嘎嘎过生日啊你的吧你要干嘛不说话的吧嗯是什么意思你还会害羞😌害羞什么的事吗你是的人都知道啊！？我都没有见过我的感受没有了吗我都不好意思给你买糖了啊
3（满分 5 分）|比如热了乾色|2020年2月18日|至钉钉团队|我在这里并没有骂钉钉的意思，我知道这一切和钉钉是没有关系的，钉钉只是提供一种渠道来帮助我们学习，但为什么还是有很多人讨厌钉钉呢，其实是老师严格的管理，就像我们老师，每天六点起床上到十一点，老师严格的管理直接导致我们产生厌烦心理，我觉得钉钉应该采取一些措施，比如设计一个健康系统，规定学生上线的最长时间这样可以合理的利用时间，其实我们可以看到，长时间的学习是对学生没有好处的，只会增加学生的厌烦心理。我觉得学习时间不一定要很长，学习时间注重的是效率，所以我认为可以限制学生上线的时间比如学生最长上线时间就是10个小时，我个人觉得10个小时就是极限了。我还看到最近有些学生上课上到精神崩溃，所以我希望钉钉团队可以重视一下这个问题
5（满分 5 分）|Reneser1|2020年2月19日|很多小功能很贴心|作为一名工作🐶，平时用了软件很少去评价的，主要是没这个习惯。但今天看到钉钉被一些人恶意耍一星差评后，本人有点坐不住了。实打实地说，钉钉在企业用户层面的功能是做得很不错的，互动方便，也不会造成额外的信息干扰，不少小功能真的是直击用户的痛点。恶意耍一星的人真不知道是哪样的一群家伙
5（满分 5 分）|S中——|2020年2月18日|致钉钉的一封信|亲爱的钉钉
5（满分 5 分）|你 小激动就到家不饿喝酒忘记|2020年2月18日|作为一名学生我想说|讲实话我从未用过钉钉 但是在这次疫情前 身边就有很多人再用 我知道钉钉是个好的软件甚至可以说非常好 但是我不明白为什么那些学生要抵制它 他的初衷是好的 学习是给谁学的 学生的本分不就是学习吗 这次寒假是一个非常好的学习机会 钉钉也给创造了这个机会 每当看到朋友圈 微博里说给钉钉一颗星 或者五星分期 我真的很不解 钉钉做错了什么 他只不过提供了一个非常好的学习工作平台 作为一名初中生 我只想说 好好珍惜现在的时光 把握好这个寒假_学习的机会 钉钉既然提供了这个机会就要珍惜 不要等到面对人生重要时刻中考或高考时刻在来后悔 我只想说珍惜钉钉，珍惜自己的人生！！！最后钉钉加油！武汉加油！中国加油！🇨🇳🇨🇳🇨🇳
5（满分 5 分）|博妹y|2020年2月17日|不想上网课可以退学谢谢|开设网课时间本来就已经正常开学了，你是学生，你不想上网课没人逼你，你可以退学，直接去工地搬砖吧，或者啥都别干了天天在家躺着，正合你们心意，挺适合你们的，你也可以直接和学校说强制你退学，刷恶意1星是不是感觉很好玩，有没有想过原来用钉钉的上班族如果因为恶意评分下架了，以后办公打卡上班怎么办？疫情耽误正常学习，开网课钉钉是收你钱了还是什么，没钉钉就没别的软件了？来这撒什么泼，一群无脑喷子。
5（满分 5 分）|虞肉肉|2020年2月17日|钉钉只有5岁，请放过|虽然我妈妈下了钉钉以后，一开始也不太能搞懂，但是现在基本ok了，而且钉钉在工作学习上也给了大家很大的保障，带来了很大的便利，如果没有钉钉，疫情当下，当然不能去学校聚集，所以难道不应该更加珍惜老师们的网上直播教学吗？
5（满分 5 分）|哥还有一会|2020年2月17日|五分一次付清哈|其实我都不给软件评分的，但最近恶意刷一星确实太过了，因为疫情已经让大家多了很多假期，平时这个时候都已经在学校起早贪黑的学习了，现在能在家学完就可以玩就知足吧，毕竟学习是自己的，爱学学，不学你们家长也会让你另外去补课的🙃
5（满分 5 分）|人间撒旦|2020年2月17日|请不要因为年轻而任性|最近由于网课导致有大量的学生给钉钉一⭐差评，甚至有人有组织的恶意差评，说心里话，挺替钉钉抱不平的，这么好用的一个软件，却遭到恶意打分。真的不应该，用钉钉五年了，它在很多方面都能够给与我们工作的便利，还是希望大家都喜欢它，能够认可并提出中肯的建议的。
5（满分 5 分）|佳➕想要变好🧸|2020年2月17日|善待初三党高三党|许多学生们觉得钉钉毁了假期 尽管我也觉得 为什么拿暑假弥补还要上网课 但是学习是我们自己的事情啊兄弟姐妹们！！慎重啊 不要因为网上一些怎样怎样的言论把别人的感受也当作自己的感受 就算不顾及自己也要顾及别人啊 所以请大家千千万万不要再刷差评了 没用的 这个没了那个还有 总之 慎重！！做个热爱生活的不好吗！
5（满分 5 分）|爱可爱小钉钉|2020年2月17日|送给故意打一星的人|不知道有些学生是怎么想的，自己不想读书你上网课的时候想干嘛都行，反正你就挂个号在哪里，但那些想读书的人怎么办？非常时期真的是委屈钉钉了，好好的一个办公软件被你们弄成这样，就算你们强制把钉钉下架也还会有别的软件来让你们学习，自己不想学也不要祸害软件好吗，摸摸钉钉小脑袋
5（满分 5 分）|shiNanjiuA|2020年2月17日|就是个移动办公软件嘛不要伤害它啦啊哈哈哈|大概是因为我不用上网课所以站着说话腰不疼 但是打一星的小朋友有没有想过它根本没想到会有意外让它被托付这么重任嘛（又心疼又好笑）所以特地下载来不分期五星啦
5（满分 5 分）|汤汤是神奇的存在|2020年2月17日|对那些说为了学生打一星的人很无语|在网上看到钉钉求救很有趣 过来看看 才知道这么多人盲目跟风 说什么不是学生了 为了学生投一星 真的搞不懂 你就算把它下架了 学生不用上课吗 不会 这样的人真的很无语 我也会用到钉钉 一开始不习惯 后来懂了 都是工作需要 这个软件下架了 我们就不工作不打卡了吗 真是些神人 虽说这是人人自由 但是不要说为了谁谁谁 是你自己心之所向
1（满分 5 分）|大写的时候|2020年2月15日|一星的理由|第一，不知道是人太多还是平台的原因，我们上课时总是出现卡顿、直播掉线等一系列的问题。如果只是一个人，那可能是网络问题。但是实际情况就是很多人都出现了这样的情况。钉钉原本是针对中小企业管理交流推出的，我国中小企业成千上万，职员是一个比学生还要广大的群体。这次疫情，钉钉下载量达几百万，在线上学习和工作的过程中明显地体现了钉钉平台的连接问题和其他影响学习和工作效率的问题。比如老师滔滔不绝沉迷上课，学生弹幕狂刷“老师你没开麦”，而老师浑然不觉直到下课。这些情况在办公时出现难道真的影响不大吗？？？我觉得钉钉还是要改进平台，一星并非全是心情使然
5（满分 5 分）|强嫂捏|2020年2月17日|虽然我没用钉钉，但是我觉得我有必要给他打5分|我觉得用来学习真的挺好的，只有经历过的人才知道学习真的很重要--来自一个没考好大学的学渣心声！我已为人母，当初上大学的时候一度想回去复读，工作了之后更后悔自己没有好好学习，所以我希望各位学生们有机会的时候好好学习，尽自己最大的努力，不要像我这样经历过了才知道学习得重要性！
5（满分 5 分）|oiksus|2020年2月17日|一点建议|直播很卡，我一直很期待直播课，但是上了很卡，所以我希望可以改进，即使以后上不到直播课，当然也不希望，毕竟直播也是挺重要的，特别是一对一培训时特别方便，主播可以知道另一个人的一举一动，好快速提高。其他的我没什么想说的，只希望这一点可以改进。
5（满分 5 分）|#Clydeshivu|2020年2月16日|来自一个初一学子|虽然我对于在疫情期间直播上课有不满，但我也不会我这些不满的情绪放在一个特别好的软件身上，疫情期间，学校也是为了我们，老师们匆忙的备课，批改作业，也不容易，我希望在疫情期间直播上课的老师和同学说，你们辛苦了，也对这个软件的开发者表达我的感谢和歉意，谢谢你们开发了这个软件，让我们能在家里安心学习，代我们不懂事的同学也向你们道歉了，不好意思
5（满分 5 分）|xha.|2020年2月16日|客观评价|我是一名马上高考的学生了，虽然上网课不太愿意但是跟成绩相比也就没什么的了，将心比心没必要去埋怨软件的事，他们开发软件的也没有错啊，这个软件也没错，要端正自己的心态平和地去面对现实.
5（满分 5 分）|踢啊住了|2020年2月16日|不要让自己的情绪施加给别人|我们现在因为疫情而上网课，而现在大部分都是用钉钉，有一些人不喜欢上课，就拿钉钉出气。我觉得钉钉很好，如果你们不喜欢上课那你们跟教育局说呀，跟国家说呀，如果假期一直呆在家里不上课，不学习，那你们以后怎么办，有本事你们跳级啊，直接上大学多好，上班多好，这样就不用学了，但是你们没有那个本事呀，既然没有那个本事那你们在这叭叭什么，你们把钉钉弄下架了国家也会通过别的方式来让你们学习的，不要把自己的情绪影响别人！！！
5（满分 5 分）|一个默默给五星的小学生。|2020年2月16日|写给给一星的同学们|我也是学生，刚开始，我也觉得，丁丁这个软件打扰了我们的假期。但到后来，我觉得这不是一个坏软件，如果有细心发现的话，就会发现有一个语音/视频通话的功能。于是我们同几个就天天视频通话。虽然对老师的讲课，没啥评价，但我们终于能见同学们了。
5（满分 5 分）|少年young89|2020年2月15日|钉钉让我工作和生活消息分开！天使！|哈哈被小学生们这波评分刷的，作为一个本公司员工也得来凑个热闹。必须5星！至少在微信不会是因为工作来找我的同事。这一点就5分。已读功能提升效率，再也不会有遇到问题不回的同事了。毕竟我看到你已读了的精神压力还是很大的。
5（满分 5 分）|孤漠奇迹|2020年2月15日|略|钉钉一直工作打卡在用，虽然不喜欢软件的一部分功能(个人懒惰原因)，这也是我第一个给评分的软件，就为了来拉个分，理由如下:
5（满分 5 分）|sdgyinnv|2020年2月15日|从来不评论软件 真的看不下去了。|上不上网课 这是学校和当地教育局说了算。和这个软件并没有什么关系。作为上班族来说 这个软件真的很方便 很快捷 解除了很多麻烦的事情。不要因为自己的私欲就和键盘侠一样无脑评价。
3（满分 5 分）|苏辰超可爱|2020年2月13日|软件其实还行|说实话这个软件内容挺好的 学生这样极端其实也是有理由的 就比如你熬夜上班连续几个月就为了完成那个任务 完成了 领带给你放了个假 你刚走出公司门口 领导突然给你打电话 假批不了了 立刻回公司 准备下一个任务 哦喔 最重要的是学生们还处于年少无知时期 这个停课不停学啥的只会增加学生对学习的厌恶 从而不愿意学习 哦喔 总结就是你们自己毁了祖国的花朵呢
5（满分 5 分）|一个满意的客户|2020年2月15日|不要以为我给了5星就是好！我只是为了让教育部看到！|亲爱的同学们，教育部的专家们、官员们，大家好！
5（满分 5 分）|ELAINEMILKMs|2020年2月15日|看看评论我都觉得你们这帮刷一星的学生可笑|1.钉钉是为工作的人用的，不是给你们上网课准备的。我们工作的人用觉得很好用，你们上网课，钉钉只是提供一个平台ok?
5（满分 5 分）|肖战的心头肉吖|2020年2月14日|我爱钉钉|真的很喜欢这个软件 爱学习的人不会抱怨软件的 刚开始有些不满 可是慢慢的 我发现 初二这个重要的时候 不学习何以中考呢 我喜欢数学老师讲那些我看不懂的题我终于听懂的感觉 喜欢英语老师讲着我最喜欢的题的感觉 疫情当头 没有这个软件 我们就是成天无所事事 这不好的 学习强国 为什么学习 因为我爱中国 🇨🇳中国加油 武汉加油💪
5（满分 5 分）|梦想飞到黄鹤楼|2020年2月14日|钉钉？愿他长寿|钉钉软件还是十分好的，页面整洁，功能齐全，为我们在家上学提供了活动范围，提供了平台。但钉钉仍然有好中不足，由于性能超群，使钉钉用户办事效率有了提高，但正是因为功能齐全，导致在家的我无自由，无私人空间，晚一分钟钉钉都会有所记录，因而被骂，我想说的是在家上学很好，但5点到位我办不到，打这些字又花了一些时间，回去还得挨骂，建议钉钉限制老师对学生的监控时间，我们需要私人空间，我们是人，不是观察品，谢谢！你们很棒
5（满分 5 分）|徐子晰妈妈|2020年2月13日|平台点评|有了这么一个平台让我们家长很轻松就能帮助孩子们完成作业，而且能全面地记录各门功课的点滴，更重要的是方便老师更全面地监督每一位孩子的点滴成长，给这个平台赞一个👍
4（满分 5 分）|Lyz2128|2020年2月13日|整体感觉还不错|我们一直用自己企业的OA系统，疫情期间，考虑到及时沟通和数据传输的时效性，我们试着用了钉钉，到目前为止感觉还不错，钉钉团队非常优秀，很多功考虑的还是比较到位的。我们计划试用一段时间，如果确实能代替我们目前自己的系统，我们可能考虑后期切换过来。
5（满分 5 分）|沐一璃|2020年2月13日|痛心|我是在疫情期间使用钉钉上课的一名高中生，真的觉得钉钉很好用，初中时我们学校曾因为肺结核病毒而回家上课，会有些卡。而现在我用钉钉上课，基本无卡顿，真的觉得这是良心软件。同时它也在疫情期间为国家，为社会，为工作的人们，更为各位同学们出力。但有些人因为自己不愿上课，就毁坏一个软件的评分，你们的良心不会痛吗？你们这样的行为是在伤害一个个为社会奉献的人心啊。
5（满分 5 分）|文家小迷妹|2020年2月13日|不想上网课不要轻易的打低分！！！|我也是一名学生，我也不想上课，不想早起，这已经很不错了。（看到最后）
5（满分 5 分）|Aran.l.aran|2020年2月13日|小孩子嘛 总归是要成长的|这种小孩子们怎么可能听得进去道理 成长大部分来自事与愿违 解决方法还是要拉到和他们一个水平—【站五星】 放心下不了架 不仅是你们的爸爸妈妈老师想让你们好好学习 还有全国的叔叔阿姨们！
4（满分 5 分）|愤怒的筱夏|2020年2月13日|给四星我要吐槽！|日志这块，今日完成，就这么扁扁的一小条框，每天完成至少都是七八条甚至十几条的内容，上下看还得拖来拖去的，看不到整体很麻烦，以前选中今日完成后，就自动从小框变成大框不是挺好挺方便的么？为什么要改掉呢？开发者看到请一定回复啊，这点能改回来就最好了。
5（满分 5 分）|庄富源|2020年2月13日|好好学习，天天向下|这个软件的帮助简直是太大了！可以有效帮助孩子的学习和社会表达能力还能直播上课呢！现在的科技越来越发达了！所以那些给一星的年轻人们真的是太愚蠢了！不好好珍惜现在的科技
5（满分 5 分）|晚星萤火|2020年2月12日|好评|这个软件真的很好，可以帮助我们在家学习，不会落下我们初三学习的中考进度，听说，因为疫情虽然延迟开学，但是不会推迟中考。 这个软件帮助我们不落下中考的进度。恶意给一心的，我觉得有够幼稚的，这本来是一个很方便的企业软件。就算你恶意给一星让它下架，但是那又怎么样，还会找到其他软件来代替。老师可以在上面给我们免费授课，我觉得很好。
5（满分 5 分）|无名氏某个人啦啦啦|2020年2月12日|加油|同为学生党，请大家不要以点一星来泄愤好嘛
5（满分 5 分）|非要输入名称？？？|2020年2月12日|祖国的未来啊|一个软件而已，科技是帮助人们的，你们打一分的小朋友，仔细想想，这样祸及旁人真的好吗，让你们上网课的真的是因为这个软件的存在吗？你们不想上网课，真的只是因为上网课这个形式吗？你们可是祖国的未来呦，要有自己的主见，要看清问题的根本，而不是在网上跟着瞎狂欢
5（满分 5 分）|冰川冰雪雅|2020年2月12日|一位初中生的感谢|因为疫情原因学校决定推迟上学，多亏有了钉钉我们这群学生才能上网课补习，本人是一名初二学生，由于从我们这届开始地理生物就要加入中考成绩，所以我对自己的地理生物一直很担心，辛亏有了它我才能好好复习地生决战中考，真的，感谢钉钉的开发者！辛苦了！
5（满分 5 分）|12467;;)?:5)|2020年2月12日|支持|一直以来用这款软件上班打卡，非常好的软件，现在特殊时期，按正常情况现在已经开学了，假期其实已经结束，给想学习想进步的孩子们一个学习机会，是很好的！只要劳逸结合，不要给孩子们太大的学习负担，适量即可。
5（满分 5 分）|🇨🇳🌈🌈🇨🇳|2020年2月11日|中国🇨🇳加油|首先作为一个刚升入高中的高一党，感谢钉钉的开发者服务于我们中小学生，当我们听到班主任发话要用钉钉上课时我们无比的激动，不仅让我们中小学生在家也能上课，还让许多敬业的老师硬生生的成为了主播，真的是太棒了这个软件～
5（满分 5 分）|每天都在倒计时|2020年2月11日|今天就要给五星|科技发展就是给人带来便利的，特殊时期不能照常开学，都在克服困难创造条件，只要自己有足够的自制力，在家难道真的一点都学不进去吗？不应该是生活条件更方便吗？自己做好就OK了，不要怪软件拖后腿了🙂
5（满分 5 分）|死不悔改花辞是也|2020年2月10日|评|首先，我并不是自愿下载，所以对钉钉映象真心好不到哪里去了……其次，开学延迟，为了成绩好看一点，所以我还是比较支持钉钉。毕竟一个人懒散惯了……真是不能看的。钉钉可以清楚的反映出自己学习了多少，是否看过重播。对此我表示太赞了👍！连我这等懒人每天都看现场直播和重播！你们有什么理由不学习😕！（我也比较喜欢看戏）看班上有同学只看了重播两分钟被老师点名批评，我心里好爽的样子～咳咳，希望各位对钉钉睁一只眼闭一只眼，（就算昧着良心）给钉钉一个五星好评吧……🤩
5（满分 5 分）|熊猫别跑|2017年9月5日|钉钉是我的私人秘书|我是做餐饮连锁的，之前听朋友介绍这个软件有多好用，自己注册后有专家免费上门培训，Ding功能消息通知真是高效方便，各分店开会直接用电话会议，日志审批数据自动汇总到智能报表，简直比秘书做的还要好！
5（满分 5 分）|刚刚还不如我们的|2018年5月11日|非常强大|才用了几天，公司的出勤信息一目了然，谁迟到矿工加班都清清楚楚，就是有一点不足，要是排班制也能设置晚走晚到就好了，为什么非要固定班制才能呢。因为我们周末是轮值的，固定班制就不能论证打卡了。纠结啊
5（满分 5 分）|优佰陈|2018年8月22日|钉钉粉的评论|钉钉功能比较全，还有很多辅助性的改善功能没有完全利用到。方便公司的办公流程。外呼系统若是能设置自己的钉钉卡进行外呼就更加优秀了，办公电话做外呼不接听比较麻烦
2（满分 5 分）|lijt2010|2020年2月7日|关于隐藏摄像头问题。|作为一个上课软件还是很合格的，在家也可以学到不少东西。不过不经他人同意就偷用摄像头是什么意思？老师监控学生很正常，但是基本上学校都是在大家都已知的情况下，可这是在自己家里，而且我们不知情！这不是公共场合！要这么干还有没有隐私的权可言？万一哪个时候拍到个人隐私怎么办？怎么对用户负责！？希望运营商可以对此功能进行整改！注：此评论纯属批评对个人隐私的侵犯并无其他含义。
5（满分 5 分）|weilyue|2019年12月31日|钉钉在线不在线，电脑写周报同步手机包括图片|电脑写周报，插入图片，文件等等，是否可以电脑写完带图片的，电脑有什么图片和手机端就同步一样的？目前就是文字同步，图片和格式都没有。非常求解救？身边超级多这样的需求伙伴
5（满分 5 分）|wwwwwwwwwwrl|2020年2月19日|钉钉|太棒了我真的特别喜欢钉钉，老师发作业发要求都特别清楚也特别容易看到，再也不用担心家长不看家长群而错过作业的烦恼了！现在特殊时期每天都能听见老师的声音，每天都有新鲜的作业，我现在过得十分充实，今年要合格考了，希望自己能自觉一点吧。钉钉提供的直播平台我非常满意，坐在家里上课，也能舒服一点。
5（满分 5 分）|当代新青年|2020年2月18日|好家伙～|小dd这东西完美迎合了当今中小学校以及高校开展教育工作的需求…在如今肺炎肆意横行的社会，空虚寂寞无聊的日子使人们的内心发生了严重的扭曲，但这必定不是使我们这可爱又实用的小dd遭受广大网友唾弃的缘由！身为21世纪的新生军，作为一名合格的学生，学习就是天职，当鲁迅弃医从文的时候，那句“学医救不了中国”是多么的无奈！而如今的学习是为了将来能够更好地甚至轻而易举地面临新病毒的出现！小dd加油💪武汉加油💪中国🇨🇳加油💪
5（满分 5 分）|不知名初三学生|2020年2月18日|不知名初三学生的想法|钉钉也太难了，看见这个评分于心不忍还是来正确评价一下吧，平心而论钉钉还是很不错的，卡顿问题其实比某些要好得多，功能也很齐全，可能存在好玩心理并不乐意上学，但是依然感谢钉钉为我们提供了学习平台，我觉得钉钉也没有差到一星的地步，中考加油！
5（满分 5 分）|ahdhdbednsjsdnuwj|2020年2月18日|一些建议|钉钉是个非常不错的上课软件（本人为宅家高中生）提一个很重要的建议哈：希望云课堂的教学视频有倍速播放，不然上完一遍课再去看回放做笔记的时候很不方便，这是我们全班同学的共同心愿！学委在此感谢开发技术人员！你们辛苦了！
5（满分 5 分）|睡鱼Mike|2020年2月18日|一位初中生|是很不错的一款软件但是可能是学校的问题使它 没有原来应有的好评 在家里学习 老师监督不了 效果不好 还不如就多放一会假呢 真搞不懂学校为什么要线上上课 天天一大堆作业 晚自习要上到九点多才行
