score|username|time|title|content
5（满分 5 分）|武汉加油中国加油💪|2020年2月17日|钉钉必行|钉钉是个很好的软件 看直播不卡 功能全面 那些打一星的人是怎么想的？？？是钉钉主动提出的要求全国用它？仔细想想如果不是这个软件本身功能好适合多人听课那它又怎么会被选中，希望大家理智一点。而且如果没有线上学习相信大部分学生也都不会真的自律，荒废时间荒废学业。我是一名中考生我很庆幸有钉钉这个软件可以督促我不然我根本就不可能每天做一轮资料不可能自己在线听课，总的来说钉钉是个很好的软件 这是我第一次给软件评分因为我觉得钉钉这么好不应该时候这么低的评分.
5（满分 5 分）|小事糊涂大事|2020年2月15日|我觉得挺好的|去年的九月份下载的钉钉，当时的目的只是为了上班打卡，不得不说钉钉的定位非常准确，当时我的位置功能不准，百度地图都不能用，可是钉钉却能准确地帮我定位。
5（满分 5 分）|打广告哈哈好的|2020年2月15日|无语了有些学生真的……好无趣|我觉得不想学的同学完全可以不上啊，钉钉也不是强制要上的，可以退出来的呀，把自己的厌学情绪带到这个软件上算什么？跟一波风就觉得自己不一样啦？不想学的人呢不管是在学校还是现在网课都是一样的，硬是要把自己不想上课搞得人尽皆知，让这个软件倒霉你们有啥好处呢，老师要是打算上课就是没有钉钉也会有别的软件的，一星的真的挺无趣的呢……人家这个软件就是帮助你们学习，也没要钱，真的学会感恩吧，无语了…但是看到还是有明事的人，软件本身并不差的呢
5（满分 5 分）|aka坚|2020年2月14日|一位不知名的水军|终于收到我需要的宝贝了，东西很好，价美物廉，谢谢老师!说实在，这是来我最满意的一次下载。无论是老师的态度还是特别耗流量，我都非常满意的。老师态度很专业热情，有问必答，回复也很快，我问了不少问题，他都不觉得烦，都会认真回答我，这点我向老师表示由衷的敬意，这样的好老师可不多。
5（满分 5 分）|一位diss者|2020年2月14日|对于现在学生评一星的行为|我并不觉得这种行为很不好 因位评星这种东西就是根据人们自己心里想的去评的 虽然肯定会对开发者和团队造成影响 但是学生们是在这个平台上强迫上课 更何况现在的教育局已经命令禁止学生上网课 所以 那个说现在学生给一星是不好行为的人 你管不着 这是他们自己的权利 但是我也觉得开发者挺惨 哎 以后加油吧
5（满分 5 分）|所不过|2020年2月13日|十分好用|办公接触的钉钉。用了两年多了，体验还是不错的。聊天记录和文件可以长时间保留，领导安排的工作还有和同事沟通的问题过了很久还可以翻聊天记录查看。直播功能和会议功能开会很方便，省去了路上的奔波。最近又上线了在线编辑功能，真是十分nice啊~~手机就可以直接填报数据，真是业界先锋！这么好用的东西，就因为被用来给学生上课就被吐槽，真是替它鸣不平~~
5（满分 5 分）|Dummer黄|2020年2月12日|感谢开发商|可能因为支持了网课，使大量学生给你们差评，但我依然支持你们开发商，是你们让我们学生可以在疫情中，仍然可以保持学习，可以说，学生应该感谢你们，让学生可以免费上网课，还支持回放，是你们推动了学业界的进步，疫情蔓延虽可怕，但，绝不可以因此落下学业，祖国的花朵们，是你们让他们绽放，是你们在背后默默守护，我谢谢你们开发商，不要在意那些人，他们不会懂得你们的心里，那些差评的，肯定是成绩不好的，我也没有炫耀自己的成绩，只是想表示自己支持开发商，不论有多少差评，我不会卸载你，永远支持开发商，你们的用心良苦，我谢谢你们！为我们创造了这么好的学习环境，让我们继续努力💪，你们在我们学业路上披荆斩棘，谢谢！给差评的人，你们的良心何在？
5（满分 5 分）|Tara塔塔|2020年2月12日|来自上班族的评论|首先我觉得钉钉真的超级方便，因为我们是互联网公司，疫情爆发后一直是分布式办公模式，钉钉打卡人性化到可以隐藏详细地址。而且公司偶尔约个会议也很方便，并没有强制打开摄像头。自从学生开始钉钉网课以后我看到评分直线下滑。真的超级心疼开发者，天天窝在办公室里写代码，勤勤恳恳的迭代，产品又这么好用，实在不该被恶意刷低分。我要打卡上班了，希望钉钉越来越好～
5（满分 5 分）|给1星的人学生将来受尽社会毒打|2020年2月12日|钉钉很好，不该无辜受牵连|不想听课打卡的你大可不必早起打卡听课写作业，在这里来故意恶评显得自己对老师对学校的反抗吗？有脾气不要早起不要去打卡，说白了还是不敢，柿子挑软的捏，所以就像发泄一样来这里给差评！钉钉开发出来也不是给你学生用的，你父母还要用钉钉办公！真的是些什么人，简直是没有受过社会的毒打，希望将来有一天这些给1星差评迁怒于钉钉的人被这个社会因为知识因为学历而狠狠羞辱之后，不会后悔今天你所做一切！
5（满分 5 分）|普通高考生|2020年2月11日|真的觉得很不错|我也不知道为什么有人专门打低分，可能都是不爱学习的吧。疫情当前唯有用这种网课的模式才能恢复往日的学习气氛。我是一名高三学生，今年的形式对于即将面对人生转折点的我们经受不起，所以我觉得这种方式帮助我们克服了不能上学耽误功课的困难。我觉得必须五星好评！
5（满分 5 分）|楚子rena|2020年2月11日|请不要当网络喷子|大家都是新时代的社会好青年 相互体谅才能造就美好未来
5（满分 5 分）|青山李|2020年2月10日|网课更符合我的要求|我个人觉得网课真的是梦想中的存在，愿意一直上网课，唯一的遗憾是不能让老师留下特别的印象，毕竟现实中不见面上大课也没有学生发言的机会。就方便程度来说在教室里上课也做不到上网课这样的程度，个人真的很讨厌跑老师办公室问问题，特别麻烦。最后就是上网课可以回放也太香了吧！！！！我爱网课！！！
3（满分 5 分）|不木啊不木|2020年2月8日|在前置摄像头上贴不透明胶带吧|钉钉这个软件整体来说挺好的，作为一个学生对于学校在寒假期间进行强制性补课是真的很不满，但软件本身没有错，扣二星的原因是让老师随意的打开前置摄像头真的不好，说白了，大多数学生认为这是侵犯隐私，毕竟是在家里，一切都是休闲舒适比较好，突然私生活被人窥探了，是个人心里都不会好受，而且是在学生不知情的情况下，至少应该有个通知和选择同意或拒绝吧，希望这点可以改进
5（满分 5 分）|不知道叫啥好……❀❀❀❀|2020年2月19日|麻烦不要跟风黑谢谢|作为一个马上初一的学生我还挺谢谢钉钉的，首先，钉钉出现的最初中心是为了更好的帮助学习，可以把学生家长聚集在一起的一款软件，本来就不是为了给我们增加学习负担的。而且，但凡是学生，假期天天待在家打游戏不做一点有意义的事情心里都会不踏实吧。疫情期间，钉钉的出现难道不是帮助我们学习吗？而且，当下状况，谁都不想颓废吧？网课除了麻烦一点真的没有别的缺点，没有耽误什么时间啊，不感觉网课的出现让本来提心吊胆的心安稳了一点吗？至少在这段期间不会感觉时间很空，至少过得很充实不是吗？
5（满分 5 分）|一清同学|2020年2月19日|希望继续加油|挺喜欢这个软件的，但是为什么黑名单不能把同事加进去?!我和弟弟各用一个号，弟弟天天给我打钉钉电话，一天几十次的电话，事实上我们一个屋檐下有什么话需要电话联系?他只是为了好玩，我只能一次又一次地拒接，很烦!我很想把它加入黑名单，但是.上面显示我们是同事，它上面说被骚扰了请举报，但是我不能举报，因为一举报我弟弟就不能用那个号.上学了。现在导致我对钉钉非常不满意，希望可以可以加一个屏蔽功能，或者更改一下黑名单的适用人群
5（满分 5 分）|看不下去的钉钉用户|2020年2月18日|一星党你们客观吗|很多人说自己的假期被占了没地方发泄 就来钉给差评 这是多少人的心血 不希望有些人道貌岸然说我下载就有权利给一星 你客观吗 你是对软件不满还是对学校不满？这就好比你妈（学校）给你找个相亲对象（要你补课）你相亲对象建议要不找个合适的馆子（钉钉）这馆子还看你相亲把餐费都免了 你因为讨厌相亲又不敢跟你妈对着干 所以把人家饭馆砸了 还觉得自己特有理 别人要去那餐馆吃饭你还要鄙视别人？人要学会控制情绪 而不是一味的发泄 有本事就跟教育局去讲 别觉得是软件害的 没有钉钉也会有其他软件 学习的前提是尊重他人劳动成果 否则未来也没人为你的知识买单 （不引战 苹果端的均分其实比另一端还是好一些…）
5（满分 5 分）|liu米麋|2020年2月18日|作为正常情况已经开学的大学生|如果没有这次的疫情，我现在应该在教室了。网上上课并没有让我觉得有什么不适，不知道为什么那么多人评论一星。这样上课不但比在学校轻松，而且！钉钉是我五个听课软件里，直播并且可以看回放的，我觉得这样非常好啊👍其他的课都没法看回放，除了录制好的慕课。我觉得很棒啊。有些人说觉得那个摄像头是在监视自己学习？那么在学习不也有老师看着吗？学自己的有什么关系？从来不给软件评分的，这次是在微博上看到钉钉发的视频了，觉得有小小可怜 哈哈哈 来评个分 但这个分绝对真情实感。
5（满分 5 分）|mushroomgu|2020年2月18日|玩梗要适度，钉钉是个好软件|因为疫情钉钉从商务软件空降到学生群体。如果我是学生小孩子我可能也会凑热闹和朋友们一起来刷一星。但是我现在是成年人了，我知道这个软件是有多少人的努力才开发出来，又有多少公司企业靠它在进行工作。小孩子们只懂好玩和发泄一时的小情绪，但这会给很多成年人的生活工作造成困扰。小孩子们不经意间造成的影响要靠很多人去挽救，就像现在我不得不来评分。拜托你们，你们不经意的玩闹，真的会连累我们。
5（满分 5 分）|超爱钉钉 钉钉最棒|2020年2月18日|支持钉钉|作为一个刚入职的职场小白来说 钉钉好像开发了我的新大陆！一个公司都近2w 还都在不一样的分部公司 人不可能都认识 但确实有时候工作会有交集 可是钉钉在同一个公司架构里就可以通过搜索找到解决问题 平常的上下班打卡 公告 审批等等 都很便利的 钉钉本身就是一个办公软件 针对职场人设计 这次国家有困难 才会变成老师上网课使用的软件 希望各位同学冷静 学习是要学到知识 而不在乎于那种形式 更何况现在是互联网时代 网课会越来越多 也要跟上脚步才对呢
5（满分 5 分）|9084你好|2020年2月16日|其实这个软件很好|这个软件设计的不错，但是当老师命令式的让学生下载这个软件的时候，学生的心理状态肯定是抗拒的，因为在原先上课的时候不需要下载这么多东西，手机内存也是充足的，这个软件设计有一个问题为什么要监测学生的后台控制摄像头呢？这样不仅侵犯隐私还随便看学生手机的后台，我觉得稍微改进一下，谢谢🙏
5（满分 5 分）|Sponsor K|2020年2月16日|少年强则国家强|少年强则国家强，打一星的同学们你们要知道你们不是每个人长大都可以当明星挣快钱，很快初中毕业、高中毕业后就会有一部分同学提前进入社会 那部分人他们更多的是没有选择，努力学习是为了让你自己今后的人生多点选择！
5（满分 5 分）|纸糖君|2020年2月14日|个人觉得非常好的一个软件。|就事论事，钉钉真的是一个非常好的软件，客服也非常大有耐心，分屏和一些其他的小功能也特别细心，我个人是真的很喜欢。那些因为不想上网课的人恶意评论，我感觉不能理解，开发者辛辛苦苦开发的软件，就因为不想上课而差评。我希望你们要好好想想，你们现在的行为是在毁坏别人的劳动成果，真的希望你们换位思考一下。还有，如果现在不上课，暑假肯定会缩短很多，那一次放假前后没有不补课呢？我希望你们可以想明白，就事论事。就酱，白～
5（满分 5 分）|可可乐乐•|2017年9月27日|非常棒的移动办公平台|钉钉这款软件我是看我身边的朋友用的，后来咨询了他一下。发现这个软件对于我们办公是十分适合的，因为我们一直想有一个专业的办公系统，而钉钉正好帮助我们解决这个问题了，并且这个办公软件我们是0成本的在使用！在使用钉钉之后我们的办公一体化了，并且非常高效，也摆脱了传统的纸质办公方式！真的是非常棒的移动办公平台，推荐大家使用！
5（满分 5 分）|郁闷的修斯|2017年9月27日|钉钉开启了新的时代|办公用了钉钉以后，将生活和办公有效的分开了。审批功能已经让公司完全进入了无纸化办公时代。考勤功能公司内外勤都可以使用，外勤地点一目了然，日志报表比邮件更方便。使用期待更多的功能模块升级来全方位帮助我们企业解决移动办公沟通问题～力推新时代的办公软件，首选钉钉～
5（满分 5 分）|Caoht001|2017年11月1日|安全又免费的办公软件，赞！|安全又免费的办公软件
5（满分 5 分）|斗战胜佛平头哥|2017年12月25日|万能的钉钉真心好用！|用钉钉两年多了，在两个公司都是管理员，钉钉的确很好用，的确是从办公角度设计的。很大程度上节约了企业管理成本，增强员工交流，提高办公效率。反观企业版微信，就呵呵了。一如既往支持马云和阿里巴巴，良心企业！只要千万别搞网络游戏像腾讯那样的精神鸦片毒害祖国的花朵就好。虽然你们可能看不到此评价，网络游戏千万别做，不要为了钱让老百姓骂你们。让你们的档次降下来，金杯银杯不如老百姓的口碑。加油阿里，加油钉钉！
5（满分 5 分）|周子浵|2020年2月14日|钉钉真的太实用了。|我本来以为在家上课就是无聊，但没想到一个小软件拯救了我。在钉钉里上课、直播非常有意思，我的心里超级开心。钉钉里还有翻译功能，我再也不怕学不会英语啦！打卡、签到者还可以领取奖状，也不像正常签到那样麻烦，我很喜欢这个软件。还有多种群类型，让我仿佛回到了亲切的学校生活。内部群还有＂员工健康＂，非常观心我们。打卡只有班主任才能看到，这就意味着学生会减少抄袭行为，我相信钉钉会越做越好！加油吧！而且钉钉已经陪伴我一年了，从4年级开始到5年级，我已经和钉钉建立了不可磨灭的关系，我给钉钉一个五星好评，是因为我还记得钉钉陪我走过的路，我也还记得钉钉带给我的温暖。(突然好感动)
5（满分 5 分）|时空之衡|2020年2月13日|学生的思想需要及时改正|作为学生，真的是没法想象现在比我们低几个年级的学生的思想，
5（满分 5 分）|像雷锋同志学习|2020年2月12日|清华北大的希望|自从病毒肆虐，便不能出家门，也不能去学校上课，高三的学生在有几个月就要高考了，不能去学校上课，不能学知识，高考怎么办啊！还好阿里推出了钉钉这款软件，可以让老师进行群直播上课，即使不出门也能学到知识，跟在学校里面上课也没有什么区别，让高三的孩子们可以在家上课学习，这是利国利民的好软件！在这里我特别感谢钉钉开发组的工作人员，在这里给大家说声谢谢，您们辛苦了！
5（满分 5 分）|Shown made|2020年2月11日|上课啊|作为一名初三党，这个软件可以说是很棒的了，本来还担心因为疫情所延迟的开学会导致本就紧迫的时间更为紧迫。感谢钉钉为我们提供了这样的一个平台，正如我们老师所说，这是一个弯道超车的好时机，各位可要把握好！提个建议，视频会议中每个人的头像有时会挡住老师的ppt（不知道是不是我没能找到解决的方法呢？），比较影响，设计一个能把头像收起来的按钮吧。
5（满分 5 分）|123456游戏不好玩|2020年2月19日|小学生请停止你们的恶性行为|作为一名快要中考的学生来说 真的很感谢钉钉 开始网课也给我们的生活提高了质量 停课不代表不能上课 以为恶意评低分你们就可以不用网课了？脑子呢？有那么多平台，全国为什么选择钉钉 还不是功能强大，整天不学习打游戏就舒服了？钉钉好歹也是那么多位程序员辛辛苦苦搞得 就因为你们这群不学无术 不想学习的人恶搞成这样？人家也努力了 今天就算你们把钉钉弄下架 全国也一定会选择另一个平台让你们学习 不可能不让你们学习 老师也在辛辛苦苦给你们录课 不感谢也可以 在那诋毁 得什么样的人品 也不知道你们怎么想的 现在疫情那么严重 还要顾给全家小孩上课 这背后辛苦的又是谁 你不好好学 不代表别人不好好学 家长们也好好教育自己的小孩 给点正确的思想 用真心话来说 钉钉真是非常不错的软件 也劝你们善良 给你授予知识 给你平台 害你了？？？ 你们可停停吧🤚
5（满分 5 分）|重中之重渣渣|2020年2月18日|我热爱学习|这个平台让我充分感受到了来自知识的关怀。它可以让我在疫情期间充分的学习到新鲜知识。避免了我去玩手机，玩电脑，看电视，刷斗音，看电影等行为。甚至帮我多年的烟瘾都给我戒掉了。每天布置的大量作业让我倍感亲切。仿佛疫情从未发生我还在学校一样。感谢钉钉让我有这么好的学习和提升自我的机会。此外，我还想提出一点意见，为什平台的主播不可以跳舞？而且还问我是哪个班的，我很想刷些礼物慰问一下给我们上课的铁子，老铁666
5（满分 5 分）|dghifsrhhgg|2020年2月18日|钉钉是办公软件|看了一星视频来的，只想说钉钉是办公软件，并不是一个直播软件或者学习软件，只不过因为它的优秀被老师们选为了直播软件，但不能因为这个就给恶意差评。多少初三高三的学生都担心死了遇到这种时刻，在疫情蔓延的时候还能有课上，难道不应该高兴吗？我是经历过非典的人，所以别说我不是经历者不知道痛苦。也许步入工作后你们就会感谢钉钉曾经在这种时刻可以给予你们上课的便利。
5（满分 5 分）|可爱幻彩女|2020年2月18日|感谢钉钉|感谢钉钉给了我们线上学习的机会 可以让自己看到自己喜欢的老师 给我们能在国难当头的紧急时刻能继续提升自己的机会 也许有许多人对于钉钉是持拒绝态度的 你可能会说，钉钉剥夺了你的假期 让自己的时间很紧很紧 没有办法好好学习
5（满分 5 分）|该用户名已被录用|2020年2月17日|钉钉太难了在哪都要上网课的别挣扎了|其实五星是过了，但是👴看不下去了钉钉太惨了。宁心情不好就把怒气发在一个软件上？？玩笑开开就算了认真就是你有问题了。
5（满分 5 分）|飘零零|2020年2月17日|后台播放要不要考虑一下|这个建议应该比较小众，我个人在听课时会退出来调分屏或者就是做其他事情，（因为有些内容真的是看不看都一样），这时直播就会自动暂停，如果时间隔比较久重进就直接卡了；后台播放的话，我可以一直听到老师讲课，讲到重点了也知道去看。
5（满分 5 分）|pink易|2020年2月17日|东西是个好东西，就是上课的时候有点卡|钉钉这个软件还是因为疫情期间，老师要上课我才接触到的，怎么说了，每次上课的很卡，而且有时候不知道是我网的问题还是软件的问题，会黑屏啥的，虽然说我也不想受这网课的折磨，老师们也不想被迫成为主播，但是这也不是钉钉的错，本来今天想着给个一星差评的，因为今天上课卡得我都快叫钉钉爸爸了，然后今天看了钉钉的那个鬼畜视频，我真的快要被笑死了，这个软件原本的用户就是企业职工用户多，现在被老师用来给学生上课，导致钉钉的评分下降，钉钉真的太可怜了，总之还是要用整体的眼光来看待问题吧
5（满分 5 分）|啊啊啊三月|2020年2月17日|请相互理解|微博的鬼畜视频太可爱啦啊啊啊啊啊！所以我来了哈哈哈哈
5（满分 5 分）|黑夜陨歌|2020年2月17日|给亲爱的儿子钉钉|既然你都叫我爸爸了，爹当然要来帮助你一下【狗头】。之前确实看到打一星的人很多，还有搬运到微博和空间的，话里话外觉得很有意思引以为豪？我觉得这种行为很幼稚！你们的课和会议也不是钉钉要开的，它只是个五岁的孩子！不敢反抗教育部门和公司就用第三方软件泄愤，很有趣吗？希望在你们长大后能学会什么叫尊重别人换位思考。
5（满分 5 分）|张逗逗逗逗逗|2020年2月15日|无语|给恶意低评的学生老师或者网友可能是智商不太够，疫情期间如真有必要需要教学或者其他，钉钉本来只是提供给大家进行授课、学习或者健康打卡的一个平台，工作人员尽职尽责的维护这样的软件也是方便我们所有人使用，还被人恶意低评，看不下去了
5（满分 5 分）|张远鲲|2020年2月15日|给恶意给差评的人|身为一个学生，我也有可能上网课。但是请回答二个问题，第一：你们以为玎玎想给当上课的平台吗？完全不是，玎玎这个软件的初衷不是给学生们用的，现在也不是。所以我们没有必要在说什么这多么的无耻，他们一点也不想让我们上课，他们得不到任何和我们相关的利益，吃力不讨好，反而多了很多差评。第二：你们以为老师会愿意的给你们上课吗？老师给你们讲课是害你们么？我也不是你们说的好学生，我也不热爱学习，但是希望大家理解这个软件，他们真的是无辜的。希望大家疫情当下彼此友好，不要无谓的对这个办公软件发泄情绪，谢谢🙏！
5（满分 5 分）|SIGEJUZI|2020年2月14日|感谢|不可以恶意抨击软件，在当下，作为学生，感谢平台提供的学习机会，中国加油！武汉加油！新时代的青少年，要能担得起责任，比起在前线抗疫的医护人员，党员干部，我们在家中，在安全区，我们要做的是为国家加油！而非幼稚的去恶意抨击，要知道不仅我们在用，很多人需要它，而且学习是一件有意义的事，我们青少年是要长大然后去接下建设社会主义强国责任的，而不是随波逐流的幼稚恶搞，这样，未来何在？我只是希望我们能为国家做点事，为疫情加把油！这个软件背后是多少技术人员的心血啊！免费使用！我们不感谢而去中伤，不觉得有些过分吗？加油钉钉，加油武汉，加油中国！
5（满分 5 分）|纯属为了五星好评|2018年4月18日|钉钉是高效的工作方式|钉钉是移动互联网的代表作，尤其是管理理念，会站在集体利益最大化的角度去思考。这不同于传统软件公司，钉钉解决了企业发展最核心的问题，就是员工的能效。特别是针对超大型企业，钉钉岂止于链接内部，更是帮助企业打造一个商业生态系统。突破企业的发展瓶颈，感谢阿里巴巴对中国企业的赋能。
5（满分 5 分）|禅心空明|2018年6月12日|工作流程审批|这个软件对于体制不健全或者沟通环节相对原始的企业是非常适用的，一般性的私企民企，在沟通环节上总是会出现一言堂或者上传下不达亦或上传下领会错误的情况。而通过系统的流程，就能够清晰明了，并且及时的传达给需知的人
